{
  "schema": "ctx.push.v1",
  "dry_run": false,
  "message": "Document the sync model",
  "server_url": "http://127.0.0.1:9",
  "repo_id": "fixture-repo",
  "new_head": "5016ea5c28221e3e40c9f8ac80acdab6ab2538d7",
  "pushed": [
    {
      "path": "wiki/analyses/sync-model.md",
      "kind": "create",
      "sha": "5016ea5c28221e3e40c9f8ac80acdab6ab2538d7"
    },
    {
      "path": "wiki/concepts/auth-flow.md",
      "kind": "update",
      "sha": "5016ea5c28221e3e40c9f8ac80acdab6ab2538d7"
    }
  ],
  "conflicts": [],
  "skipped": [
    {
      "path": "wiki/concepts/broken.md",
      "state": "invalid",
      "reason": "invalid"
    },
    {
      "path": "wiki/concepts/legacy-sync.md",
      "state": "unverified",
      "reason": "unverified"
    },
    {
      "path": "wiki/concepts/old-name.md",
      "state": "deleted_local",
      "reason": "deleted_local"
    },
    {
      "path": "wiki/concepts/rate-limits.md",
      "state": "conflict",
      "reason": "conflict",
      "server_sha": "a8f6897201450db5da7dc1ef07acb171871935db"
    }
  ],
  "distill": {
    "required": false,
    "bypassed": false
  },
  "warnings": []
}
