{
  "schema": "ctx.push.v1",
  "dry_run": false,
  "message": "Tighten the rate limits",
  "server_url": "http://127.0.0.1:9",
  "repo_id": "fixture-repo",
  "new_head": "8040b3bbce4371c3317e18e4754d71cc9c8c0207",
  "pushed": [
    {
      "path": "wiki/analyses/sync-model.md",
      "kind": "create",
      "sha": "8040b3bbce4371c3317e18e4754d71cc9c8c0207"
    },
    {
      "path": "wiki/concepts/auth-flow.md",
      "kind": "update",
      "sha": "8040b3bbce4371c3317e18e4754d71cc9c8c0207"
    }
  ],
  "conflicts": [
    {
      "path": "wiki/concepts/rate-limits.md",
      "kind": "both_modified",
      "base_sha": "5f11c75e91a8738813fdcd33ff41f9ddbb665e2d",
      "server_sha": "a8f6897201450db5da7dc1ef07acb171871935db"
    }
  ],
  "skipped": [
    {
      "path": "wiki/concepts/broken.md",
      "state": "invalid",
      "reason": "invalid"
    },
    {
      "path": "wiki/concepts/legacy-sync.md",
      "state": "unverified",
      "reason": "unverified"
    },
    {
      "path": "wiki/concepts/old-name.md",
      "state": "deleted_local",
      "reason": "deleted_local"
    }
  ],
  "distill": {
    "required": false,
    "bypassed": false
  },
  "warnings": []
}
