{
  "schema": "ctx.push.v1",
  "dry_run": false,
  "message": "ctx push (1 pages)",
  "server_url": "http://127.0.0.1:9",
  "repo_id": "fixture-repo",
  "new_head": "7eb582be7e0b3502ba5ca3af1e0bb3da3edf68bb",
  "pushed": [
    {
      "path": "wiki/concepts/rate-limits.md",
      "kind": "update",
      "sha": "7eb582be7e0b3502ba5ca3af1e0bb3da3edf68bb"
    }
  ],
  "conflicts": [],
  "skipped": [],
  "distill": {
    "required": false,
    "bypassed": false
  },
  "warnings": []
}
